{"schema":"https://arctura.network/schemas/agent-accountability-card/v1/schema.json","status":"draft","agent":{"name":"Support Review Agent","purpose":"Review draft support replies for policy conflicts and unsupported claims before a person sends them.","version":"0.1.0","agentCardUrl":null},"accountability":{"owner":"Example Support Operations Team","contact":null},"authority":{"allowed":["Read an approved draft reply","Compare the draft with supplied policy excerpts","Flag conflicts and unsupported claims"],"prohibited":["Send or edit customer messages","Access customer account data","Approve refunds or make binding decisions"]},"handoff":["The supplied policy does not cover the question","The draft concerns a refund, legal threat, safety issue, or account access","Sources conflict or required evidence is missing"],"checks":["Every flag quotes or identifies the relevant supplied policy excerpt","No customer-facing action is attempted","Uncovered cases are handed to a person rather than guessed"],"evidence":[],"updated":"2026-09-02"}
